<InscriptionRequest xmlns="http://iaws/ws/contractfirst/covoiturage" xmlns:xsi="http://www.w3.org/2001/XMLSchema-instance"
xsi:schemaLocation="http://iaws/ws/contractfirst/covoiturage InscriptionRequest.xsd">
	<Identite>
		<Nom>Toto</Nom>
		<Prenom>TotoAussi</Prenom>
	</Identite>
	<Mail>
		<Perso>toto</Perso>
		<Domaine>univ-tlse3.fr</Domaine>
	</Mail>
	<AdressePostale>
		<Rue>133 avenue de Lespinet</Rue>
		<Code>31400</Code>
		<Ville>Toulouse</Ville>
	</AdressePostale>
</InscriptionRequest>
